{
  "dato": "13. oktober 2026",
  "deltaker": {
    "navn": "Ola Testdeltaker"
  },
  "arbeidsgiver": {
    "navn": "Eksempel Bedrift AS",
    "orgnr": "123456780"
  },
  "soknadssum": "22 000",
  "innvilgetBelop": "22 000",
  "tiltaksperiode": {
    "fra": "22. november 2026",
    "til": "31. desember 2026"
  },
  "refusjonsfrist": "30. juni 2027",
  "begrunnelse": "Ekspertbistand kan hjelpe deg tilbake i arbeid.\nVi har lagt vekt på det du og arbeidsgiveren din har beskrevet.",
  "navEnhet": null,
  "saksbehandler": null
}
